Sheet: Trams
A1: id | B1: impl | C1: name | D1: designation | E1: nick | F1: cost m. | G1: c (irl) | H1: len (m) | I1: len (ttd) | K1: intr | L1: speed | M1: kw | N1: hp | O1: weight | P1: cost
A2: HRO/HKL
A3: horse | B3: x | C3: Horse-drawn Tram | D3: 1-15 | F3: 1 | G3: 14+11 | H3: 5.8 | I3: of:=[.$D$73] * [.H3] -> 3.05263157894737 | K3: 1890 | L3: 20 | N3: 5 | O3: 1.6 | P3: of:=RUNCOST([.L3]; [.M3]/0.73549875+[.N3]; [.O3]; [.F3]) -> 
A4: kummer | B4: x | C4: Kummer | D4: HRO 1-35 | E4: Kummeri | F4: 1 | G4: 16+12 | H4: 7.2 | I4: of:=[.$D$73] * [.H4] -> 3.78947368421053 | K4: 1900 | L4: 25 | N4: of:=2*25 -> 50 | O4: 8.5 | P4: of:=RUNCOST([.L4]; [.M4]/0.73549875+[.N4]; [.O4]; [.F4]) -> 
A5: a3 | B5: x | C5: A3 | D5: HRO 36-112 / HKL 1-67 | E5: Pikkuruotsalainen | F5: 1 | G5: 20+18 | H5: 8.7 | I5: of:=[.$D$73] * [.H5] -> 4.57894736842105 | K5: 1908 | L5: 27 | N5: of:=2*30 -> 60 | O5: 9.5 | P5: of:=RUNCOST([.L5]; [.M5]/0.73549875+[.N5]; [.O5]; [.F5]) -> 
D6: HKL 68-69 | E6: Jumbo | F6: 1 | G6: 28+24 | H6: 11.5 | I6: of:=[.$D$73] * [.H6] -> 6.05263157894737 | K6: 1917 | N6: of:=4*36 -> 144 | P6: of:=RUNCOST([.L6]; [.M6]/0.73549875+[.N6]; [.O6]; [.F6]) -> 
A7: a4 | B7: x | C7: A4 | D7: HRO 151-170 / HKL 71-90 | E7: Jenkki | F7: 1 | G7: 21+26 | H7: 10.3 | I7: of:=[.$D$73] * [.H7] -> 5.42105263157895 | K7: 1920 | L7: 30 | N7: of:=2*36 -> 72 | O7: 11 | P7: of:=RUNCOST([.L7]; [.M7]/0.73549875+[.N7]; [.O7]; [.F7]) -> 
A8: a5 | C8: A5 | D8: HRO 171-200 / HKL 91-120 | E8: Sakemanni | F8: 1 | G8: 21+26 | H8: 10.2 | I8: of:=[.$D$73] * [.H8] -> 5.36842105263158 | K8: 1924 | N8: of:=2*36 -> 72 | O8: 11.4 | P8: of:=RUNCOST([.L8]; [.M8]/0.73549875+[.N8]; [.O8]; [.F8]) -> 
A9: a7 | C9: A7 | D9: HRO 121-150, 401-412 / HKL 121-162 | E9: Isoruotsalainen | F9: 1 | G9: 21+26 | H9: 10.2 | I9: of:=[.$D$73] * [.H9] -> 5.36842105263158 | K9: 1928 | L9: 40 | N9: of:=2*56 -> 112 | O9: 12.5 | P9: of:=RUNCOST([.L9]; [.M9]/0.73549875+[.N9]; [.O9]; [.F9]) -> 
A10: hmi | C10: HM I | D10: HRO 413-430 / HKL 163-180 | F10: 1 | G10: 21+29 | H10: 10.2 | I10: of:=[.$D$73] * [.H10] -> 5.36842105263158 | K10: 1941 | N10: of:=2*75 -> 150 | O10: 15 | P10: of:=RUNCOST([.L10]; [.M10]/0.73549875+[.N10]; [.O10]; [.F10]) -> 
A11: a12 | B11: x | C11: A12 | D11: HRO 431-436 / HKL 181-186 | E11: Arkku | F11: 1 | G11: 30+34 | H11: 12.5 | I11: of:=[.$D$73] * [.H11] -> 6.57894736842105 | K11: 1941 | L11: 45 | N11: of:=4*49 -> 196 | O11: 15.9 | P11: of:=RUNCOST([.L11]; [.M11]/0.73549875+[.N11]; [.O11]; [.F11]) -> 
A12: hmii | C12: HM II | D12: HKL 187-202 | E12: Pulavaunu | F12: 1 | G12: 18+41 | H12: 10.2 | I12: of:=[.$D$73] * [.H12] -> 5.36842105263158 | K12: 1947 | N12: of:=2*78 -> 156 | O12: 15 | P12: of:=RUNCOST([.L12]; [.M12]/0.73549875+[.N12]; [.O12]; [.F12]) -> 
A13: hmiii | C13: HM III | D13: HKL 203-218 | F13: 1 | G13: 18+41 | H13: 10.2 | I13: of:=[.$D$73] * [.H13] -> 5.36842105263158 | K13: 1950 | N13: of:=2*78 -> 156 | O13: 15 | P13: of:=RUNCOST([.L13]; [.M13]/0.73549875+[.N13]; [.O13]; [.F13]) -> 
D14: HKL 219-226 | E14: Panssarivaunu | F14: 1 | G14: 18+41 | H14: 10.2 | I14: of:=[.$D$73] * [.H14] -> 5.36842105263158 | K14: 1950 | N14: of:=2*78 -> 156 | O14: 15 | P14: of:=RUNCOST([.L14]; [.M14]/0.73549875+[.N14]; [.O14]; [.F14]) -> 
A15: hmiv | B15: x | C15: HM IV | D15: HKL 301-330 | E15: Ratti-Karjaa | F15: 1 | G15: 29+69 | H15: 13.5 | I15: of:=[.$D$73] * [.H15] -> 7.10526315789474 | K15: 1955 | L15: 50 | M15: of:=4*50 -> 200 | O15: 19.8 | P15: of:=RUNCOST([.L15]; [.M15]/0.73549875+[.N15]; [.O15]; [.F15]) -> 
A16: rmi | C16: RM I | D16: HKL 331-375 | E16: Pikku-Valmet | F16: 1 | G16: 29+69 | H16: 13.5 | I16: of:=[.$D$73] * [.H16] -> 7.10526315789474 | K16: 1955 | M16: of:=4*50 -> 200 | O16: 20 | P16: of:=RUNCOST([.L16]; [.M16]/0.73549875+[.N16]; [.O16]; [.F16]) -> 
A17: hmv | B17: x | C17: HM V | D17: HKL 1-15 | E17: Keppi-Karjaa | F17: 1 | G17: 31+57 | H17: 13.5 | I17: of:=[.$D$73] * [.H17] -> 7.10526315789474 | K17: 1959 | L17: 60 | M17: of:=4*50 -> 200 | O17: 20 | P17: of:=RUNCOST([.L17]; [.M17]/0.73549875+[.N17]; [.O17]; [.F17]) -> 
A18: rmiii | C18: RM III | D18: HKL 16-30 | E18: Iso-Valmet | F18: 1 | G18: 31+57 | H18: 13.5 | I18: of:=[.$D$73] * [.H18] -> 7.10526315789474 | K18: 1959 | M18: of:=4*50 -> 200 | O18: 20 | P18: of:=RUNCOST([.L18]; [.M18]/0.73549875+[.N18]; [.O18]; [.F18]) -> 
A19: man | C19: MAN | D19: HKL 151-154 | E19: Manne | F19: 1 | G19: 52+93 | H19: 19.1 | I19: of:=[.$D$73] * [.H19] -> 10.0526315789474 | K19: 1970 | M19: of:=2*120 -> 240 | O19: 21 | P19: of:=RUNCOST([.L19]; [.M19]/0.73549875+[.N19]; [.O19]; [.F19]) -> 
A20: nrvi | B20: x | C20: NRV I | D20: HKL 31-70 | E20: Sarana | F20: 1 | G20: 39+100 | H20: 20.1 | I20: of:=[.$D$73] * [.H20] -> 10.5789473684211 | K20: 1973 | L20: 65 | M20: of:=2*130 -> 260 | O20: 28.1 | P20: of:=RUNCOST([.L20]; [.M20]/0.73549875+[.N20]; [.O20]; [.F20]) -> 
A21: nrvii | B21: x | C21: NRV II | D21: HKL 71-112 | E21: Sarana | F21: 1 | G21: 40+100 | H21: 20 | I21: of:=[.$D$73] * [.H21] -> 10.5263157894737 | K21: 1983 | L21: 70 | M21: of:=2*130 -> 260 | O21: 27.2 | P21: of:=RUNCOST([.L21]; [.M21]/0.73549875+[.N21]; [.O21]; [.F21]) -> 
A22: mlrvi | B22: x | C22: MLRV I | D22: HKL 201-240 | E22: Vario | F22: 1 | G22: 55+80 | H22: 24.4 | I22: of:=[.$D$73] * [.H22] -> 12.8421052631579 | K22: 1998 | L22: 75 | M22: of:=12*45 -> 540 | O22: 35 | P22: of:=RUNCOST([.L22]; [.M22]/0.73549875+[.N22]; [.O22]; [.F22]) -> 
C23: GT 8 | D23: HKL 150 | E23: Ludde | F23: 1 | G23: 64+140 | H23: 25.7 | I23: of:=[.$D$73] * [.H23] -> 13.5263157894737 | K23: 2004 | M23: of:=2*120 -> 240 | O23: 25 | P23: of:=RUNCOST([.L23]; [.M23]/0.73549875+[.N23]; [.O23]; [.F23]) -> 
A24: mlnrvii | B24: x | C24: MLRNV II | D24: HKL 71-112 | E24: Välipala | F24: 1 | G24: 49+120 | H24: 26.5 | I24: of:=[.$D$73] * [.H24] -> 13.9473684210526 | K24: 2008 | M24: of:=2*156 -> 312 | O24: 33.5 | P24: of:=RUNCOST([.L24]; [.M24]/0.73549875+[.N24]; [.O24]; [.F24]) -> 
C25: MILMAN | D25: HKL 161-166 | E25: Pitkä Manne | F25: 1 | G25: 55+120 | H25: 25.7 | I25: of:=[.$D$73] * [.H25] -> 13.5263157894737 | K25: 2008 | M25: of:=2*120 -> 240 | O25: 26 | P25: of:=RUNCOST([.L25]; [.M25]/0.73549875+[.N25]; [.O25]; [.F25]) -> 
A26: mlnrvi | C26: MLRNV I | D26: HKL 113-122 | E26: Välipala | F26: 1 | G26: 49+120 | H26: 26.5 | I26: of:=[.$D$73] * [.H26] -> 13.9473684210526 | K26: 2013 | M26: of:=2*130 -> 260 | O26: 33.5 | P26: of:=RUNCOST([.L26]; [.M26]/0.73549875+[.N26]; [.O26]; [.F26]) -> 
A27: mlnrviii | B27: x | C27: MLNRV III | D27: HKL 401-460 | E27: Artic | F27: 1 | G27: 74+14 | H27: 27.6 | I27: of:=[.$D$73] * [.H27] -> 14.5263157894737 | K27: 2013 | L27: 90 | M27: of:=8*85 -> 680 | O27: 41.6 | P27: of:=RUNCOST([.L27]; [.M27]/0.73549875+[.N27]; [.O27]; [.F27]) -> 
A28: jokeri | B28: x | D28: HKL 601-629 | E28: Jokeri | F28: 1 | G28: 76+180 | H28: 34.5 | I28: of:=[.$D$73] * [.H28] -> 18.1578947368421 | K28: 2019 | L28: 100 | P28: of:=RUNCOST([.L28]; [.M28]/0.73549875+[.N28]; [.O28]; [.F28]) -> 
I29: of:=[.$D$73] * [.H29] -> 0 | P29: of:=RUNCOST([.L29]; [.M29]/0.73549875+[.N29]; [.O29]; [.F29]) -> 
A30: tamp | C30: Tampere Tram | D30: Tampere Tramway | K30: 2022 | P30: of:=RUNCOST([.L30]; [.M30]/0.73549875+[.N30]; [.O30]; [.F30]) -> 
D31: BS 1 | E31: Jumbo | H31: 11.5 | I31: of:=[.$D$73] * [.H31] -> 6.05263157894737 | K31: 2007 | M31: of:=4*50 -> 200 | O31: 18 | P31: of:=RUNCOST([.L31]; [.M31]/0.73549875+[.N31]; [.O31]; [.F31]) -> 
A32: gt6mnf | C32: GT6M-NF | D32: HKL 300 | G32: 60+120 | H32: 27.3 | I32: of:=[.$D$73] * [.H32] -> 14.3684210526316 | K32: 1994 | L32: 70 | M32: of:=3*85 -> 255 | O32: 28
A33: zet2200 | C33: ZET 2200 | D33: HKL 2263 | G33: 48+154 | H33: 32 | I33: of:=[.$D$73] * [.H33] -> 16.8421052631579 | K33: 2007 | M33: of:=3*2*65 -> 390
I34: of:=[.$D$73] * [.H34] -> 0
A36: TUKL
C37: Horse-drawn tram | D37: TKL 1-5
D38: TKL 1-13 | G38: 18+20 | H38: 7.7 | I38: of:=[.$D$73] * [.H38] -> 4.05263157894737 | K38: 1908 | M38: of:=2*18.4 -> 36.8
D39: TKL 14-15 | H39: 7.9 | I39: of:=[.$D$73] * [.H39] -> 4.15789473684211 | K39: 1921 | M39: of:=2*30 -> 60
D40: TKL 16-23 | G40: 13+37 | H40: 10 | I40: of:=[.$D$73] * [.H40] -> 5.26315789473684 | K40: 1933 | M40: of:=2*48 -> 96
D41: TKL 24-33 | G41: 13+37 | H41: 10 | I41: of:=[.$D$73] * [.H41] -> 5.26315789473684 | K41: 1934 | M41: of:=2*48 -> 96
D42: TKL 34-37 | G42: 13+37 | H42: 10 | I42: of:=[.$D$73] * [.H42] -> 5.26315789473684 | K42: 1944 | M42: of:=2*48 -> 96
D43: TKL 38-47 | G43: 13+37 | H43: 9.7 | I43: of:=[.$D$73] * [.H43] -> 5.10526315789474 | K43: 1951 | M43: of:=2*55.2 -> 110.4
C70: Ideas:
C71: Spårakoff from HM V, other interesting liveries aswell? Kulttuuriratikka from GT8 Multiple ad liveries exist Trailers to create more variation HRO colors for some old trams (requires sprite additions) TUKL recolour
C72: Formulas
C73: length (m)/length (ttd lu) | D73: of:=1/1.9 -> 0.526315789473684
K135: hhh